{
  "fixture_version": 1,
  "request_hash": "5dda0d846d97875fb9e972c7cedb17d294b5b81645135894102b65aaa03d9f0e",
  "provider": "any",
  "model": "any",
  "task": "correctness_review",
  "prompt_id": "correctness",
  "prompt_version": "correctness:v1:472b8c34",
  "schema_hash": "3d175f915b29ad6025bd3b02bfeef90ddea257bf2d3f65b4e9b9c9b3a990e8be",
  "synthetic": true,
  "recorded_at": "2026-10-08T00:00:00Z",
  "engine_git_sha": null,
  "response": {
    "output": {
      "json": {
        "findings": [
          {
            "category": "correctness",
            "title": "Credit is written after the transaction commits",
            "claim": "S1 commits the debit before writing the credit, so a failure between them loses money outside the transaction",
            "description": "S1 commits the debit before writing the credit, so a failure between them loses money outside the transaction",
            "severity": "critical",
            "anchor": {
              "ref": "S1",
              "side": "head",
              "start_line": 13,
              "end_line": 14
            },
            "affected_refs": [
              "S1"
            ],
            "evidence": [
              {
                "kind": "changed_source",
                "ref": "S1",
                "side": "head",
                "start_line": 14,
                "end_line": 14,
                "quote": "await runner.manager.query('UPDATE accounts SET balance = balance + $2 WHERE id = $1', [to, amount]);",
                "explanation": "The credit runs after commitTransaction."
              }
            ],
            "claimed_relations": [],
            "predicate": {
              "kind": "transaction_boundary_changed",
              "subject": "S1",
              "params": []
            },
            "corrective_direction": "Move the credit back before commitTransaction.",
            "self_confidence": 0.7
          }
        ],
        "no_findings_reason": null
      }
    },
    "usage": {
      "input_uncached": 0,
      "cache_write": 0,
      "cache_read": 0,
      "output": 0,
      "reasoning": 0
    },
    "finish_reason": "complete"
  },
  "latency_ms": 0
}
