{
  "fixture_version": 1,
  "request_hash": "5b56a8c63b5f9af5d016c6d0195e47a927aee45eb8be37f8ac3ab816ade5ab43",
  "provider": "any",
  "model": "any",
  "task": "correctness_review",
  "prompt_id": "correctness",
  "prompt_version": "correctness:v1:472b8c34",
  "schema_hash": "3d175f915b29ad6025bd3b02bfeef90ddea257bf2d3f65b4e9b9c9b3a990e8be",
  "synthetic": true,
  "recorded_at": "2026-10-08T00:00:00Z",
  "engine_git_sha": null,
  "response": {
    "output": {
      "json": {
        "findings": [
          {
            "category": "security",
            "title": "authorize no longer enforces PermissionService.check",
            "claim": "S1 dropped the call to N3, so N1 lets any signed-in user update any user through N2",
            "description": "AuthService.authorize only rejects anonymous users now. AdminService.updateUser relies on it before writing, and AdminController.update exposes it without a guard.",
            "severity": "high",
            "anchor": {
              "ref": "S1",
              "side": "head",
              "start_line": 10,
              "end_line": 14
            },
            "affected_refs": [
              "S1",
              "N1",
              "N2"
            ],
            "evidence": [
              {
                "kind": "changed_source",
                "ref": "S1",
                "side": "base",
                "start_line": 14,
                "end_line": 14,
                "quote": "await this.permissions.check(user, resource);",
                "explanation": "The base version enforced the permission check."
              },
              {
                "kind": "caller_path",
                "ref": "N1",
                "side": "head",
                "start_line": 15,
                "end_line": 15,
                "quote": "await this.auth.authorize(actor, { ownerId: target.id, organizationId: target.organizationId });",
                "explanation": "updateUser relies on authorize before writing."
              }
            ],
            "claimed_relations": [
              {
                "from": "N1",
                "relation": "calls",
                "to": "S1"
              },
              {
                "from": "N2",
                "relation": "reaches_endpoint",
                "to": "N1"
              }
            ],
            "predicate": {
              "kind": "call_removed",
              "subject": "S1",
              "params": [
                {
                  "name": "callee",
                  "value": "N3"
                }
              ]
            },
            "corrective_direction": "Restore the PermissionService.check call in authorize.",
            "self_confidence": 0.85
          }
        ],
        "no_findings_reason": null
      }
    },
    "usage": {
      "input_uncached": 0,
      "cache_write": 0,
      "cache_read": 0,
      "output": 0,
      "reasoning": 0
    },
    "finish_reason": "complete"
  },
  "latency_ms": 0
}
