{
  "fixture_version": 1,
  "request_hash": "3b76cb0d00c5de083f8f5d6d217ceb954128b7a18f7b2484055f51f6dae522e2",
  "provider": "any",
  "model": "any",
  "task": "correctness_review",
  "prompt_id": "correctness",
  "prompt_version": "correctness:v1:472b8c34",
  "schema_hash": "3d175f915b29ad6025bd3b02bfeef90ddea257bf2d3f65b4e9b9c9b3a990e8be",
  "synthetic": true,
  "recorded_at": "2026-10-08T00:00:00Z",
  "engine_git_sha": null,
  "response": {
    "output": {
      "json": {
        "findings": [
          {
            "category": "correctness",
            "title": "ownerNames dereferences an optional owner",
            "claim": "N1 uses r.owner!.name although owner is optional",
            "description": "N1 uses r.owner!.name although owner is optional",
            "severity": "medium",
            "anchor": {
              "ref": "N1",
              "side": "head",
              "start_line": 16,
              "end_line": 16
            },
            "affected_refs": [
              "N1"
            ],
            "evidence": [
              {
                "kind": "changed_source",
                "ref": "N1",
                "side": "head",
                "start_line": 16,
                "end_line": 16,
                "quote": "return rows.map((r) => r.owner!.name);",
                "explanation": "owner is declared optional."
              }
            ],
            "claimed_relations": [],
            "predicate": {
              "kind": "null_check_removed",
              "subject": "N1",
              "params": []
            },
            "corrective_direction": "Filter rows without an owner.",
            "self_confidence": 0.7
          }
        ],
        "no_findings_reason": null
      }
    },
    "usage": {
      "input_uncached": 0,
      "cache_write": 0,
      "cache_read": 0,
      "output": 0,
      "reasoning": 0
    },
    "finish_reason": "complete"
  },
  "latency_ms": 0
}
