{
  "fixture_version": 1,
  "request_hash": "3e6c03819b5b277b8820a625ec72a936928b9f6375cd7a26676a011ca9f45a8e",
  "provider": "any",
  "model": "any",
  "task": "correctness_review",
  "prompt_id": "correctness",
  "prompt_version": "correctness:v1:472b8c34",
  "schema_hash": "3d175f915b29ad6025bd3b02bfeef90ddea257bf2d3f65b4e9b9c9b3a990e8be",
  "synthetic": true,
  "recorded_at": "2026-10-08T00:00:00Z",
  "engine_git_sha": null,
  "response": {
    "output": {
      "json": {
        "findings": [],
        "no_findings_reason": "Comment-only change."
      }
    },
    "usage": {
      "input_uncached": 0,
      "cache_write": 0,
      "cache_read": 0,
      "output": 0,
      "reasoning": 0
    },
    "finish_reason": "complete"
  },
  "latency_ms": 0
}
