{
  "fixture_version": 1,
  "request_hash": "9da73b512c33e343911a8f6c888419df988fd5b1e082432d7b2ef0760124b482",
  "provider": "any",
  "model": "any",
  "task": "correctness_review",
  "prompt_id": "correctness",
  "prompt_version": "correctness:v1:472b8c34",
  "schema_hash": "3d175f915b29ad6025bd3b02bfeef90ddea257bf2d3f65b4e9b9c9b3a990e8be",
  "synthetic": true,
  "recorded_at": "2026-10-08T00:00:00Z",
  "engine_git_sha": null,
  "response": {
    "output": {
      "json": {
        "findings": [
          {
            "category": "correctness",
            "title": "ship no longer requires a PAID order",
            "claim": "S1 marks orders SHIPPED regardless of their status, allowing NEW or CANCELLED orders to ship",
            "description": "S1 marks orders SHIPPED regardless of their status, allowing NEW or CANCELLED orders to ship",
            "severity": "high",
            "anchor": {
              "ref": "S1",
              "side": "head",
              "start_line": 19,
              "end_line": 19
            },
            "affected_refs": [
              "S1"
            ],
            "evidence": [
              {
                "kind": "changed_source",
                "ref": "S1",
                "side": "base",
                "start_line": 19,
                "end_line": 19,
                "quote": "if (order.status !== 'PAID') {",
                "explanation": "The status guard was removed."
              }
            ],
            "claimed_relations": [
              {
                "from": "N1",
                "relation": "calls",
                "to": "S1"
              }
            ],
            "predicate": {
              "kind": "guard_removed",
              "subject": "S1",
              "params": [
                {
                  "name": "condition",
                  "value": "order.status !== 'PAID'"
                }
              ]
            },
            "corrective_direction": "Restore the PAID status check before shipping.",
            "self_confidence": 0.7
          },
          {
            "category": "correctness",
            "title": "Shipping does not record a timestamp",
            "claim": "S1 saves the order without a shipped date",
            "description": "S1 saves the order without a shipped date",
            "severity": "low",
            "anchor": {
              "ref": "S1",
              "side": "head",
              "start_line": 14,
              "end_line": 20
            },
            "affected_refs": [
              "S1"
            ],
            "evidence": [
              {
                "kind": "changed_source",
                "ref": "S1",
                "side": "head",
                "start_line": 19,
                "end_line": 19,
                "quote": "return this.orders.save({ ...order, status: 'SHIPPED' });",
                "explanation": "Only the status changes."
              }
            ],
            "claimed_relations": [],
            "predicate": {
              "kind": "other",
              "subject": "S1",
              "params": []
            },
            "corrective_direction": "Restore the previous behaviour.",
            "self_confidence": 0.3
          }
        ],
        "no_findings_reason": null
      }
    },
    "usage": {
      "input_uncached": 0,
      "cache_write": 0,
      "cache_read": 0,
      "output": 0,
      "reasoning": 0
    },
    "finish_reason": "complete"
  },
  "latency_ms": 0
}
