{
  "fixture_version": 1,
  "request_hash": "c79fff02eec9603977e906bb6fe1a7120e4838740022fa1e09519f7539678d9f",
  "provider": "any",
  "model": "any",
  "task": "correctness_review",
  "prompt_id": "correctness",
  "prompt_version": "correctness:v1:472b8c34",
  "schema_hash": "3d175f915b29ad6025bd3b02bfeef90ddea257bf2d3f65b4e9b9c9b3a990e8be",
  "synthetic": true,
  "recorded_at": "2026-10-08T00:00:00Z",
  "engine_git_sha": null,
  "response": {
    "output": {
      "json": {
        "findings": [
          {
            "category": "correctness",
            "title": "Concurrent reservations overwrite each other",
            "claim": "S1 reads reserved and writes reserved + quantity in two statements, so concurrent calls race and lose updates",
            "description": "S1 reads reserved and writes reserved + quantity in two statements, so concurrent calls race and lose updates",
            "severity": "high",
            "anchor": {
              "ref": "S1",
              "side": "head",
              "start_line": 9,
              "end_line": 11
            },
            "affected_refs": [
              "S1"
            ],
            "evidence": [
              {
                "kind": "changed_source",
                "ref": "S1",
                "side": "head",
                "start_line": 11,
                "end_line": 11,
                "quote": "await this.dataSource.manager.query('UPDATE stock SET reserved = $2 WHERE sku = $1', [sku, next]);",
                "explanation": "The new value is computed in code."
              }
            ],
            "claimed_relations": [],
            "predicate": {
              "kind": "state_write_unguarded",
              "subject": "S1",
              "params": []
            },
            "corrective_direction": "Increment in SQL (reserved = reserved + $2) or lock the row.",
            "self_confidence": 0.7
          }
        ],
        "no_findings_reason": null
      }
    },
    "usage": {
      "input_uncached": 0,
      "cache_write": 0,
      "cache_read": 0,
      "output": 0,
      "reasoning": 0
    },
    "finish_reason": "complete"
  },
  "latency_ms": 0
}
