{
  "fixture_version": 1,
  "request_hash": "5bbde3989cf9473f856edc09262d93c7d16c89a64d1737ce39ac928d666bda35",
  "provider": "any",
  "model": "any",
  "task": "correctness_review",
  "prompt_id": "correctness",
  "prompt_version": "correctness:v1:472b8c34",
  "schema_hash": "3d175f915b29ad6025bd3b02bfeef90ddea257bf2d3f65b4e9b9c9b3a990e8be",
  "synthetic": true,
  "recorded_at": "2026-10-08T00:00:00Z",
  "engine_git_sha": null,
  "response": {
    "output": {
      "json": {
        "findings": [
          {
            "category": "correctness",
            "title": "charge now throws for non-positive amounts",
            "claim": "S1 throws BillingError instead of returning null, leaving the error unhandled in callers",
            "description": "S1 throws BillingError instead of returning null, leaving the error unhandled in callers",
            "severity": "medium",
            "anchor": {
              "ref": "S1",
              "side": "head",
              "start_line": 13,
              "end_line": 13
            },
            "affected_refs": [
              "S1"
            ],
            "evidence": [
              {
                "kind": "changed_source",
                "ref": "S1",
                "side": "head",
                "start_line": 13,
                "end_line": 13,
                "quote": "throw new BillingError('invalid amount');",
                "explanation": "The method throws where it returned null."
              }
            ],
            "claimed_relations": [],
            "predicate": {
              "kind": "contract_changed",
              "subject": "S1",
              "params": []
            },
            "corrective_direction": "Return null again or catch the error in callers.",
            "self_confidence": 0.7
          }
        ],
        "no_findings_reason": null
      }
    },
    "usage": {
      "input_uncached": 0,
      "cache_write": 0,
      "cache_read": 0,
      "output": 0,
      "reasoning": 0
    },
    "finish_reason": "complete"
  },
  "latency_ms": 0
}
