{
  "fixture_version": 1,
  "request_hash": "1c8dc804e2b08a91c063dd50bfedd6dac94c47cd7731d889379f34dd9c8f5f1b",
  "provider": "any",
  "model": "any",
  "task": "correctness_review",
  "prompt_id": "correctness",
  "prompt_version": "correctness:v1:472b8c34",
  "schema_hash": "3d175f915b29ad6025bd3b02bfeef90ddea257bf2d3f65b4e9b9c9b3a990e8be",
  "synthetic": true,
  "recorded_at": "2026-10-08T00:00:00Z",
  "engine_git_sha": null,
  "response": {
    "output": {
      "json": {
        "findings": [
          {
            "category": "correctness",
            "title": "merge spreads a possibly null settings object",
            "claim": "S1 removed the null check, so a null current value is spread without defaults",
            "description": "S1 removed the null check, so a null current value is spread without defaults",
            "severity": "medium",
            "anchor": {
              "ref": "S1",
              "side": "head",
              "start_line": 10,
              "end_line": 12
            },
            "affected_refs": [
              "S1"
            ],
            "evidence": [
              {
                "kind": "changed_source",
                "ref": "S1",
                "side": "base",
                "start_line": 11,
                "end_line": 11,
                "quote": "if (current === null || current === undefined) {",
                "explanation": "The null check was removed."
              }
            ],
            "claimed_relations": [],
            "predicate": {
              "kind": "null_check_removed",
              "subject": "S1",
              "params": []
            },
            "corrective_direction": "Keep the null check.",
            "self_confidence": 0.7
          }
        ],
        "no_findings_reason": null
      }
    },
    "usage": {
      "input_uncached": 0,
      "cache_write": 0,
      "cache_read": 0,
      "output": 0,
      "reasoning": 0
    },
    "finish_reason": "complete"
  },
  "latency_ms": 0
}
