{
  "fixture_version": 1,
  "request_hash": "5ee67aa2acddead2815c4b6450caad957a148391092aa312e92b23c65d58fe34",
  "provider": "any",
  "model": "any",
  "task": "correctness_review",
  "prompt_id": "correctness",
  "prompt_version": "correctness:v1:472b8c34",
  "schema_hash": "3d175f915b29ad6025bd3b02bfeef90ddea257bf2d3f65b4e9b9c9b3a990e8be",
  "synthetic": true,
  "recorded_at": "2026-10-08T00:00:00Z",
  "engine_git_sha": null,
  "response": {
    "output": {
      "json": {
        "findings": [
          {
            "category": "correctness",
            "title": "Multi-row save is not wrapped in a transaction",
            "claim": "S1 writes several entries one by one without a transaction, so a failure leaves a partial write",
            "description": "S1 writes several entries one by one without a transaction, so a failure leaves a partial write",
            "severity": "high",
            "anchor": {
              "ref": "S1",
              "side": "head",
              "start_line": 20,
              "end_line": 21
            },
            "affected_refs": [
              "S1"
            ],
            "evidence": [
              {
                "kind": "changed_source",
                "ref": "S1",
                "side": "head",
                "start_line": 21,
                "end_line": 21,
                "quote": "await manager.save(entry);",
                "explanation": "Each entry is saved separately."
              }
            ],
            "claimed_relations": [],
            "predicate": {
              "kind": "transaction_boundary_changed",
              "subject": "S1",
              "params": []
            },
            "corrective_direction": "Wrap the loop in a transaction.",
            "self_confidence": 0.7
          }
        ],
        "no_findings_reason": null
      }
    },
    "usage": {
      "input_uncached": 0,
      "cache_write": 0,
      "cache_read": 0,
      "output": 0,
      "reasoning": 0
    },
    "finish_reason": "complete"
  },
  "latency_ms": 0
}
