{
  "fixture_version": 1,
  "request_hash": "2cb8ac2cc6c2b3629f941b0355bc2acd74c7df0660be443c8951499e8ef30df5",
  "provider": "any",
  "model": "any",
  "task": "correctness_review",
  "prompt_id": "correctness",
  "prompt_version": "correctness:v1:472b8c34",
  "schema_hash": "3d175f915b29ad6025bd3b02bfeef90ddea257bf2d3f65b4e9b9c9b3a990e8be",
  "synthetic": true,
  "recorded_at": "2026-10-08T00:00:00Z",
  "engine_git_sha": null,
  "response": {
    "output": {
      "json": {
        "findings": [
          {
            "category": "correctness",
            "title": "Settlement failures are silently converted to null",
            "claim": "S1 catches every error from N1 and returns null, so callers cannot tell a failed settlement from a skipped one",
            "description": "S1 catches every error from N1 and returns null, so callers cannot tell a failed settlement from a skipped one",
            "severity": "high",
            "anchor": {
              "ref": "S1",
              "side": "head",
              "start_line": 12,
              "end_line": 13
            },
            "affected_refs": [
              "S1"
            ],
            "evidence": [
              {
                "kind": "changed_source",
                "ref": "S1",
                "side": "head",
                "start_line": 13,
                "end_line": 13,
                "quote": "return null;",
                "explanation": "The BillingError is no longer raised."
              }
            ],
            "claimed_relations": [
              {
                "from": "S1",
                "relation": "catches_errors_of",
                "to": "N1"
              }
            ],
            "predicate": {
              "kind": "error_swallowed",
              "subject": "S1",
              "params": [
                {
                  "name": "callee",
                  "value": "N1"
                }
              ]
            },
            "corrective_direction": "Rethrow a BillingError with the cause.",
            "self_confidence": 0.7
          },
          {
            "category": "correctness",
            "title": "Amount is not rounded before charging",
            "claim": "S1 forwards the raw amount",
            "description": "S1 forwards the raw amount",
            "severity": "low",
            "anchor": {
              "ref": "S1",
              "side": "head",
              "start_line": 9,
              "end_line": 15
            },
            "affected_refs": [
              "S1"
            ],
            "evidence": [
              {
                "kind": "changed_source",
                "ref": "S1",
                "side": "head",
                "start_line": 9,
                "end_line": 9,
                "quote": "async settle(customerId: string, amount: number): Promise<ChargeResult | null> {",
                "explanation": "The amount is passed through."
              }
            ],
            "claimed_relations": [],
            "predicate": {
              "kind": "other",
              "subject": "S1",
              "params": []
            },
            "corrective_direction": "Restore the previous behaviour.",
            "self_confidence": 0.3
          }
        ],
        "no_findings_reason": null
      }
    },
    "usage": {
      "input_uncached": 0,
      "cache_write": 0,
      "cache_read": 0,
      "output": 0,
      "reasoning": 0
    },
    "finish_reason": "complete"
  },
  "latency_ms": 0
}
