{
  "fixture_version": 1,
  "request_hash": "0bf30bdd76a6f80dcc7ed9e2ed5b876e22c64d651c166d6482206f043e85d0ff",
  "provider": "any",
  "model": "any",
  "task": "correctness_review",
  "prompt_id": "correctness",
  "prompt_version": "correctness:v1:472b8c34",
  "schema_hash": "3d175f915b29ad6025bd3b02bfeef90ddea257bf2d3f65b4e9b9c9b3a990e8be",
  "synthetic": true,
  "recorded_at": "2026-10-08T00:00:00Z",
  "engine_git_sha": null,
  "response": {
    "output": {
      "json": {
        "findings": [
          {
            "category": "security",
            "title": "deactivate no longer checks the admin role",
            "claim": "S1 removed the admin role check, so any caller can deactivate users",
            "description": "S1 removed the admin role check, so any caller can deactivate users",
            "severity": "high",
            "anchor": {
              "ref": "S1",
              "side": "head",
              "start_line": 19,
              "end_line": 21
            },
            "affected_refs": [
              "S1"
            ],
            "evidence": [
              {
                "kind": "changed_source",
                "ref": "S1",
                "side": "base",
                "start_line": 20,
                "end_line": 20,
                "quote": "if (actor.role !== 'admin') {",
                "explanation": "The role check was removed."
              }
            ],
            "claimed_relations": [
              {
                "from": "N1",
                "relation": "calls",
                "to": "S1"
              }
            ],
            "predicate": {
              "kind": "guard_removed",
              "subject": "S1",
              "params": []
            },
            "corrective_direction": "Restore the role check.",
            "self_confidence": 0.7
          }
        ],
        "no_findings_reason": null
      }
    },
    "usage": {
      "input_uncached": 0,
      "cache_write": 0,
      "cache_read": 0,
      "output": 0,
      "reasoning": 0
    },
    "finish_reason": "complete"
  },
  "latency_ms": 0
}
