{
  "fixture_version": 1,
  "request_hash": "84cd78ac5b7351703acec650675853ec98e0b8ad772dd0f09251071dced18f3b",
  "provider": "any",
  "model": "any",
  "task": "correctness_review",
  "prompt_id": "correctness",
  "prompt_version": "correctness:v1:472b8c34",
  "schema_hash": "3d175f915b29ad6025bd3b02bfeef90ddea257bf2d3f65b4e9b9c9b3a990e8be",
  "synthetic": true,
  "recorded_at": "2026-10-08T00:00:00Z",
  "engine_git_sha": null,
  "response": {
    "output": {
      "json": {
        "findings": [
          {
            "category": "correctness",
            "title": "Retried jobs send the email twice",
            "claim": "S1 no longer checks the sent store, so a retried or duplicated job sends a duplicate email",
            "description": "S1 no longer checks the sent store, so a retried or duplicated job sends a duplicate email",
            "severity": "medium",
            "anchor": {
              "ref": "S1",
              "side": "head",
              "start_line": 26,
              "end_line": 29
            },
            "affected_refs": [
              "S1"
            ],
            "evidence": [
              {
                "kind": "changed_source",
                "ref": "S1",
                "side": "base",
                "start_line": 27,
                "end_line": 27,
                "quote": "if (await this.sent.has(job.id)) {",
                "explanation": "The idempotency check was removed."
              }
            ],
            "claimed_relations": [],
            "predicate": {
              "kind": "guard_removed",
              "subject": "S1",
              "params": []
            },
            "corrective_direction": "Restore the sent-store check before sending.",
            "self_confidence": 0.7
          }
        ],
        "no_findings_reason": null
      }
    },
    "usage": {
      "input_uncached": 0,
      "cache_write": 0,
      "cache_read": 0,
      "output": 0,
      "reasoning": 0
    },
    "finish_reason": "complete"
  },
  "latency_ms": 0
}
